send_order,prospect_id,agency_name,website,verified_email,verification_status,verification_source,source_evidence,phone,send_status,recommended_action,notes
1,P001,Page Pros,https://www.pagepros.io/,info@pagepros.io,verified_public_email,official_website,"Official website Canada Office lists Phone: (437) 826-4020 Email: info@pagepros.io",+1 437-826-4020,ready_to_send,"Send Page Pros email from michael@brieffactory.com with no attachment.","Top fit. Use Toronto roofing sample angle."
2,P002,Local SEO Search,https://www.localseosearch.ca/,info@localseosearch.ca,verified_public_email,official_website,"Official website header/footer lists info@localseosearch.ca",+1 416-888-8756,ready_to_send,"Send Local SEO Search email from michael@brieffactory.com with no attachment.","Top fit. Use local SEO/client reporting angle."
3,P003,Reputation.ca,https://www.reputation.ca/,info@reputation.ca,verified_public_email,official_website,"Official website Contact section lists E-mail: info@reputation.ca",+1 888-505-5023,ready_to_send,"Send Reputation.ca email from michael@brieffactory.com with no attachment.","Top fit. Use reputation signal brief angle."
4,ALT001,NKPR,https://nkpr.net/,info@nkpr.net,verified_public_email,official_website,"Official website contact area lists info@nkpr.net",+1 416-365-3630,ready_to_send,"Use as replacement for dNovo in first email-only batch.","PR agency fit. Use PR/client intelligence angle."
5,ALT002,BrandLume,https://brandlume.com/,shine@brandlume.com,verified_public_email,official_website,"Official website footer lists Email: shine@brandlume.com",+1 855-864-6283,ready_to_send,"Use as replacement for Local Service Booster in first email-only batch.","Strong digital marketing and white-label fit. Use agency reporting/white-label angle."
HOLD,P004,dNovo Group,https://dnovogroup.com/,,no_public_email_found,official_website_review,"Official website shows contact forms and phone numbers but no public email found in crawled page.",+1 855-908-0588,hold_contact_form_only,"Do not cold email yet. Use contact form or phone only unless a public email is found.","Original top 5, but not email-ready."
HOLD,P005,Local Service Booster SEO,https://localservicebooster.com/,,no_public_email_found,site_unavailable_search_review,"Website open failed and public email search returned no verified email.",+1 800-462-9543,hold_contact_form_or_phone_only,"Do not cold email yet. Use contact form/phone if verified manually.","Original top 5, but not email-ready."
