order,company,email,subject,owner,status,contacted_date,next_step,reply_status,notes
1,Ignite Visibility,opportunity@ignitevisibility.com,White-label intelligence briefs for agency accounts,Michael,hold,,,not_started,Do not contact until approved.
2,Mad Fish Digital,team@madfishdigital.com,White-label client intelligence layer for digital accounts,Michael,hold,,,not_started,Do not contact until approved.
3,Direct Online Marketing,info@directom.com,Quick idea for DOM client reporting,Michael,hold,,,not_started,Do not contact until approved.
4,Sagefrog Marketing Group,success@sagefrog.com,Client intelligence briefs for B2B accounts,Michael,hold,,,not_started,Do not contact until approved.
5,Brolik,info@brolik.com,Weekly intelligence briefs for home-service accounts,Michael,hold,,,not_started,Do not contact until approved.
6,Postali,hello@postali.com,Client intelligence briefs for legal marketing accounts,Michael,hold,,,not_started,Do not contact until approved.
7,Brafton,info@brafton.com,White-label intelligence briefs for content strategy teams,Michael,hold,,,not_started,Do not contact until approved.
8,Big Sea,hello@bigsea.co,Client intelligence briefs for mission-driven accounts,Michael,hold,,,not_started,Do not contact until approved.
9,Siege Media,hello@siegemedia.com,Brief layer for content and GEO accounts,Michael,hold,,,not_started,Do not contact until approved.
